{
  "id": 4,
  "title": "Detection Infrastructure",
  "description": "Learn how ClearTriage's AWS-based security monitoring protects our FedRAMP boundary, including Security Hub alerts, log analysis, and incident response procedures.",
  "requiredForMembers": ["Pete", "Dave", "Shelly", "Savvy", "Krista", "Braden"],
  "objectives": [
    "Navigate AWS Security Hub and understand security findings",
    "Interpret security alerts and their severity levels",
    "Perform basic log analysis using CloudWatch and CloudTrail",
    "Follow proper incident response procedures for security events",
    "Use AWS Systems Manager Incident Manager for formal incidents"
  ],
  "sections": ["a"],
  "estimatedDuration": 25
}